Nome_estado,setor,emp,dep,sit,capital,desp_investimento,lucros,link,indicio_dependencia,tipo_indicio
Espiríto Santo,FINANCEIRO,Banestes Banco do Estado do Espírito Santo,Não Dependente Com Indícios De Dependência,ATIVA,0,110647839.57,370619945.89,https://ri.banestes.com.br/docs/Relatorio-de-Sustentabilidade-banestes-2023-12-31-KB8g9N78.pdf,sim,sim
Espiríto Santo,SANEAMENTO,Companhia Espírito Santense de Saneamento,Não Dependente Com Indícios De Dependência,ATIVA,0,841819749,173544718,https://www.cesan.com.br/a-cesan/,sim,sim
Espiríto Santo,TRANSPORTE,Companhia Estadual de Transportes Coletivos de Passageiros do Espírito Santo,Não Dependente Com Indícios De Dependência,ATIVA,106526984.64,250459.42,6911299.57,https://ceturb.es.gov.br/missao-visao-e-valores,sim,sim
Goiás,INFORMÁTICA E TECNOLOGIA DA INFORMAÇÃO,Empresa Estadual de Processamento de Dados de Goiás,Não Dependente Com Indícios De Dependência,EM LIQUIDAÇÃO,32978837.29,0,7012876.72,http://www.administracao.go.gov.br,sim,sim
Piauí,SANEAMENTO,Águas e Esgotos do Piauí SA,Não Dependente Com Indícios De Dependência,ATIVA,0,0,-113845359,https://www.agespisa.com.br/site/pages/public/index.jsf,sim,sim
Piauí,GÁS E DERIVADOS,Companhia de Gás do Piauí,Não Dependente Com Indícios De Dependência,ATIVA,0,40461.5,-1611218.06,Site não disponível,sim,sim
Piauí,PORTOS E HIDROVIAS,Companhia de Terminais Alfandegados do Piauí,Não Dependente Com Indícios De Dependência,ATIVA,21293103.47,648956.25,0,https://portopiaui.com/#,sim,sim
Piauí,INFORMÁTICA E TECNOLOGIA DA INFORMAÇÃO,Empresa de Tecnologia da Informação do Piauí,Não Dependente Com Indícios De Dependência,ATIVA,268975323.76,2972850.09,-87174869.65,https://www.etipi.com.br/documentos/governanca,sim,sim
Rio Grande do Sul,TRANSPORTE,Empresa Gaúcha de Rodovias,Não Dependente Com Indícios De Dependência,ATIVA,0,92096960.87,0,https://egr.rs.gov.br/inicial,sim,sim
Rio Grande do Sul,ABASTECIMENTO DE ALIMENTOS E OUTROS INSUMOS,Companhia Estadual de Silos e Armazéns,Não Dependente Com Indícios De Dependência,EM LIQUIDAÇÃO,156662573.61,0,-668276819.52,http://www.cesa.rs.gov.br/novosite/,sim,sim
Rio de Janeiro,ENERGIA,Centrais Elétricas Fluminenses SA,Não Dependente Com Indícios De Dependência,EM LIQUIDAÇÃO,0,0,-720,Site não disponível,sim,sim
Rondônia,PORTOS E HIDROVIAS,Sociedade de Portos e Hidrovias do Estado de Rondônia,Não Dependente Com Indícios De Dependência,ATIVA,1000000,543157.86,2946630.68,https://rondonia.ro.gov.br/wp-content/uploads/2024/04/SEI_0047420215_Ato_3.pdf,sim,sim
São Paulo,TRANSPORTE,Companhia do Metropolitano de São Paulo,Não Dependente Com Indícios De Dependência,ATIVA,0,2682447014.75,-900175857.05,https://governancacorporativa.metrosp.com.br/Documentos%20Compartilhados/CartaPoliticasPublicas.pdf,sim,sim
